{
  "$schema": "https://json-schema.org/draft/2020-12/schema",
  "$id": "https://mistria-codex/schema/maps.json",
  "title": "maps",
  "description": "Hand-drawn region maps. No game art. Generated from packages/schema — do not edit.",
  "type": "array",
  "items": {
    "type": "object",
    "properties": {
      "id": {
        "type": "string",
        "minLength": 1,
        "pattern": "^[a-z0-9]+(?:_[a-z0-9]+)*$"
      },
      "name": {
        "type": "string",
        "minLength": 1
      },
      "numeric_id": {
        "default": null,
        "anyOf": [
          {
            "type": "integer",
            "minimum": -9007199254740991,
            "maximum": 9007199254740991
          },
          {
            "type": "null"
          }
        ]
      },
      "numeric_id_game_version": {
        "default": null,
        "anyOf": [
          {
            "type": "string"
          },
          {
            "type": "null"
          }
        ]
      },
      "id_status": {
        "default": "provisional",
        "type": "string",
        "enum": [
          "provisional",
          "confirmed_stale",
          "confirmed"
        ]
      },
      "former_ids": {
        "default": [],
        "type": "array",
        "items": {
          "type": "string",
          "minLength": 1,
          "pattern": "^[a-z0-9]+(?:_[a-z0-9]+)*$"
        }
      },
      "game_version": {
        "default": null,
        "anyOf": [
          {
            "type": "string"
          },
          {
            "type": "null"
          }
        ]
      },
      "version_added": {
        "default": null,
        "anyOf": [
          {
            "type": "string"
          },
          {
            "type": "null"
          }
        ]
      },
      "confidence": {
        "type": "string",
        "enum": [
          "verified",
          "wiki",
          "inferred"
        ]
      },
      "prov": {
        "type": "object",
        "propertyNames": {
          "type": "string"
        },
        "additionalProperties": {
          "type": "string",
          "enum": [
            "game_files",
            "wiki_cargo",
            "wiki_page",
            "manual",
            "community_archive"
          ]
        }
      },
      "data_gaps": {
        "default": [],
        "type": "array",
        "items": {
          "type": "string"
        }
      },
      "icon_key": {
        "default": null,
        "anyOf": [
          {
            "type": "string"
          },
          {
            "type": "null"
          }
        ]
      },
      "wiki_page": {
        "default": null,
        "anyOf": [
          {
            "type": "string"
          },
          {
            "type": "null"
          }
        ]
      },
      "blurb": {
        "default": null,
        "anyOf": [
          {
            "type": "string",
            "maxLength": 300
          },
          {
            "type": "null"
          }
        ]
      },
      "svg": {
        "default": null,
        "anyOf": [
          {
            "type": "string",
            "minLength": 1
          },
          {
            "type": "null"
          }
        ]
      },
      "view_box": {
        "type": "string",
        "pattern": "^-?\\d+(?:\\.\\d+)? -?\\d+(?:\\.\\d+)? \\d+(?:\\.\\d+)? \\d+(?:\\.\\d+)?$"
      },
      "map_version": {
        "default": 1,
        "type": "integer",
        "minimum": 1,
        "maximum": 9007199254740991
      },
      "layers": {
        "default": [],
        "type": "array",
        "items": {
          "type": "string"
        }
      },
      "not_to_scale": {
        "default": true,
        "type": "boolean"
      }
    },
    "required": [
      "id",
      "name",
      "numeric_id",
      "numeric_id_game_version",
      "id_status",
      "former_ids",
      "game_version",
      "version_added",
      "confidence",
      "prov",
      "data_gaps",
      "icon_key",
      "wiki_page",
      "blurb",
      "svg",
      "view_box",
      "map_version",
      "layers",
      "not_to_scale"
    ],
    "additionalProperties": false
  }
}
